mysql> insert into student (name, email, dob, roll_no) values("Ankit", "ankit@gmail.com", "2021-08-03", "1"); 
Query OK, 1 row affected (0.01 sec)

mysql> insert into student (name, email, dob, roll_no) values("Amit", "amit@gmail.com", "2021-08-03", "2");
Query OK, 1 row affected (0.01 sec)

mysql> update student set dob = "2021-01-01" where roll_no = "2"; 
Query OK, 1 row affected (0.01 sec) 

mysql> select * from student;                                                                                                                                 
+-------+-----------------+------------+---------+                                                                                                            
| name  | email           | dob        | roll_no |                                                                                                            
+-------+-----------------+------------+---------+                                                                                                            
| Ankit | ankit@gmail.com | 2021-08-03 | 1       |                                                                                                            
| Amit  | amit@gmail.com  | 2021-01-01 | 2       |                                                                                                            
+-------+-----------------+------------+---------+ 
2 rows in set (0.00 sec)

mysql> delete from student where roll_no = "2"; 
Query OK, 1 row affected (0.01 sec) 

mysql> select * from student;                                                                                                                                 
+-------+-----------------+------------+---------+                                                                                                            
| name  | email           | dob        | roll_no |                                                                                                            
+-------+-----------------+------------+---------+                                                                                                            
| Ankit | ankit@gmail.com | 2021-08-03 | 1       |                                                                                                                                                                                                                      
+-------+-----------------+------------+---------+ 
1 rows in set (0.00 sec)

mysql> select roll_no as roll from student;                                                                                                                   
+------+                                                                                                                                                      
| roll |                                                                                                                                                      
+------+                                                                                                                                                      
| 1    |                                                                                                                                                      
+------+                                                                                                                                                      
1 row in set (0.00 sec) 
